{
  "current_claims": [],
  "discovered_issue_inventory": [
    {
      "endpoint_role": "implementation_authority",
      "issue_id": "I-authority-1",
      "metadata_byte_limit": 8192,
      "metadata_scalar_byte_limit": 8192,
      "metadata_total_bytes": 4096,
      "root_requirement_id": "R-1",
      "status": "done",
      "workflow_instance_id": "workflow-1",
      "workspace_lease_owner_agent_id": "agent-integrator",
      "workspace_lease_owner_issue_id": "T-holder-1",
      "workspace_lease_scope": "requirement",
      "workspace_lease_state": "integrator",
      "workspace_lease_transition_record": null
    },
    {
      "endpoint_role": "final_integration_validation_mirror",
      "issue_id": "I-mirror-1",
      "metadata_byte_limit": 8192,
      "metadata_scalar_byte_limit": 8192,
      "metadata_total_bytes": 4096,
      "root_requirement_id": "R-1",
      "status": "done",
      "workflow_instance_id": "workflow-1",
      "workspace_lease_owner_agent_id": "agent-integrator",
      "workspace_lease_owner_issue_id": "T-holder-1",
      "workspace_lease_scope": "requirement",
      "workspace_lease_state": "integrator",
      "workspace_lease_transition_record": null
    },
    {
      "endpoint_role": "implementation_authority",
      "issue_id": "I-authority-2",
      "metadata_byte_limit": 8192,
      "metadata_scalar_byte_limit": 8192,
      "metadata_total_bytes": 4096,
      "root_requirement_id": "R-2",
      "status": "done",
      "workflow_instance_id": "workflow-2",
      "workspace_lease_owner_agent_id": "agent-integrator",
      "workspace_lease_owner_issue_id": "T-holder-2",
      "workspace_lease_scope": "requirement",
      "workspace_lease_state": "released",
      "workspace_lease_transition_record": null
    },
    {
      "endpoint_role": "final_integration_validation_mirror",
      "issue_id": "I-mirror-2",
      "metadata_byte_limit": 8192,
      "metadata_scalar_byte_limit": 8192,
      "metadata_total_bytes": 4096,
      "root_requirement_id": "R-2",
      "status": "done",
      "workflow_instance_id": "workflow-2",
      "workspace_lease_owner_agent_id": "agent-integrator",
      "workspace_lease_owner_issue_id": "T-holder-2",
      "workspace_lease_scope": "requirement",
      "workspace_lease_state": "released",
      "workspace_lease_transition_record": null
    }
  ],
  "discovered_requirement_root_ids": [
    "R-1",
    "R-2"
  ],
  "endpoint_inventory": [
    {
      "endpoint_role": "implementation_authority",
      "issue_id": "I-authority-1",
      "metadata_byte_limit": 8192,
      "metadata_scalar_byte_limit": 8192,
      "metadata_total_bytes": 4096,
      "root_requirement_id": "R-1",
      "status": "done",
      "workflow_instance_id": "workflow-1",
      "workspace_lease_owner_agent_id": "agent-integrator",
      "workspace_lease_owner_issue_id": "T-holder-1",
      "workspace_lease_scope": "requirement",
      "workspace_lease_state": "integrator",
      "workspace_lease_transition_record": null
    },
    {
      "endpoint_role": "final_integration_validation_mirror",
      "issue_id": "I-mirror-1",
      "metadata_byte_limit": 8192,
      "metadata_scalar_byte_limit": 8192,
      "metadata_total_bytes": 4096,
      "root_requirement_id": "R-1",
      "status": "done",
      "workflow_instance_id": "workflow-1",
      "workspace_lease_owner_agent_id": "agent-integrator",
      "workspace_lease_owner_issue_id": "T-holder-1",
      "workspace_lease_scope": "requirement",
      "workspace_lease_state": "integrator",
      "workspace_lease_transition_record": null
    },
    {
      "endpoint_role": "implementation_authority",
      "issue_id": "I-authority-2",
      "metadata_byte_limit": 8192,
      "metadata_scalar_byte_limit": 8192,
      "metadata_total_bytes": 4096,
      "root_requirement_id": "R-2",
      "status": "done",
      "workflow_instance_id": "workflow-2",
      "workspace_lease_owner_agent_id": "agent-integrator",
      "workspace_lease_owner_issue_id": "T-holder-2",
      "workspace_lease_scope": "requirement",
      "workspace_lease_state": "released",
      "workspace_lease_transition_record": null
    },
    {
      "endpoint_role": "final_integration_validation_mirror",
      "issue_id": "I-mirror-2",
      "metadata_byte_limit": 8192,
      "metadata_scalar_byte_limit": 8192,
      "metadata_total_bytes": 4096,
      "root_requirement_id": "R-2",
      "status": "done",
      "workflow_instance_id": "workflow-2",
      "workspace_lease_owner_agent_id": "agent-integrator",
      "workspace_lease_owner_issue_id": "T-holder-2",
      "workspace_lease_scope": "requirement",
      "workspace_lease_state": "released",
      "workspace_lease_transition_record": null
    }
  ],
  "inventory_complete": true,
  "inventory_selection_rule": "protocol-v4-terminal-authority-mirror-v1",
  "migration_groups": [
    {
      "authority": {
        "endpoint_role": "implementation_authority",
        "issue_id": "I-authority-1",
        "metadata_byte_limit": 8192,
        "metadata_scalar_byte_limit": 8192,
        "metadata_total_bytes": 4096,
        "root_requirement_id": "R-1",
        "status": "done",
        "workflow_instance_id": "workflow-1",
        "workspace_lease_owner_agent_id": "agent-integrator",
        "workspace_lease_owner_issue_id": "T-holder-1",
        "workspace_lease_scope": "requirement",
        "workspace_lease_state": "integrator",
        "workspace_lease_transition_record": null
      },
      "git": {
        "branch": "req/R-1-completed",
        "clean": true,
        "expected_branch": "req/R-1-completed",
        "expected_head_sha": "1111111111111111111111111111111111111111",
        "expected_worktree_id": "worktree-1",
        "head_sha": "1111111111111111111111111111111111111111",
        "unfinished_operations": [],
        "worktree_id": "worktree-1"
      },
      "historical_holder": {
        "active": false,
        "agent_id": "agent-integrator",
        "agent_role": "integrator",
        "issue_id": "T-holder-1",
        "root_requirement_id": "R-1",
        "status": "done",
        "workflow_instance_id": "workflow-1"
      },
      "mirror": {
        "endpoint_role": "final_integration_validation_mirror",
        "issue_id": "I-mirror-1",
        "metadata_byte_limit": 8192,
        "metadata_scalar_byte_limit": 8192,
        "metadata_total_bytes": 4096,
        "root_requirement_id": "R-1",
        "status": "done",
        "workflow_instance_id": "workflow-1",
        "workspace_lease_owner_agent_id": "agent-integrator",
        "workspace_lease_owner_issue_id": "T-holder-1",
        "workspace_lease_scope": "requirement",
        "workspace_lease_state": "integrator",
        "workspace_lease_transition_record": null
      },
      "root": {
        "active_child_issue_ids": [],
        "approval_evidence_current": true,
        "approved_policy_digest": "v3.sha256:6666666666666666666666666666666666666666666666666666666666666666",
        "current_plan_revision": 2,
        "current_policy_digest": "v3.sha256:6666666666666666666666666666666666666666666666666666666666666666",
        "current_target_branch": "req/R-1-completed",
        "delivery_complete": true,
        "delivery_evidence_current": true,
        "issue_id": "R-1",
        "merge_evidence_current": true,
        "open_approval_gates": [],
        "pending_review_issue_ids": [],
        "plan_frozen_fields": [
          "plan_revision",
          "policy_digest",
          "target_branch"
        ],
        "plan_revision": 2,
        "plan_schema_version": 3,
        "review_evidence_current": true,
        "status": "done",
        "target_branch": "req/R-1-completed",
        "workflow_instance_id": "workflow-1",
        "workspace_mode": "lightweight"
      }
    },
    {
      "authority": {
        "endpoint_role": "implementation_authority",
        "issue_id": "I-authority-2",
        "metadata_byte_limit": 8192,
        "metadata_scalar_byte_limit": 8192,
        "metadata_total_bytes": 4096,
        "root_requirement_id": "R-2",
        "status": "done",
        "workflow_instance_id": "workflow-2",
        "workspace_lease_owner_agent_id": "agent-integrator",
        "workspace_lease_owner_issue_id": "T-holder-2",
        "workspace_lease_scope": "requirement",
        "workspace_lease_state": "released",
        "workspace_lease_transition_record": null
      },
      "git": {
        "branch": "req/R-2-completed",
        "clean": true,
        "expected_branch": "req/R-2-completed",
        "expected_head_sha": "1111111111111111111111111111111111111111",
        "expected_worktree_id": "worktree-2",
        "head_sha": "1111111111111111111111111111111111111111",
        "unfinished_operations": [],
        "worktree_id": "worktree-2"
      },
      "historical_holder": {
        "active": false,
        "agent_id": "agent-integrator",
        "agent_role": "integrator",
        "issue_id": "T-holder-2",
        "root_requirement_id": "R-2",
        "status": "done",
        "workflow_instance_id": "workflow-2"
      },
      "mirror": {
        "endpoint_role": "final_integration_validation_mirror",
        "issue_id": "I-mirror-2",
        "metadata_byte_limit": 8192,
        "metadata_scalar_byte_limit": 8192,
        "metadata_total_bytes": 4096,
        "root_requirement_id": "R-2",
        "status": "done",
        "workflow_instance_id": "workflow-2",
        "workspace_lease_owner_agent_id": "agent-integrator",
        "workspace_lease_owner_issue_id": "T-holder-2",
        "workspace_lease_scope": "requirement",
        "workspace_lease_state": "released",
        "workspace_lease_transition_record": null
      },
      "root": {
        "active_child_issue_ids": [],
        "approval_evidence_current": true,
        "approved_policy_digest": "v3.sha256:6666666666666666666666666666666666666666666666666666666666666666",
        "current_plan_revision": 2,